_id,id,genres,rating,release_date,runtime,source,summary,title,type
685682fc8482e0a7a0072697,tvmaze_100,"Drama, Crime",8.1,2010-09-24,60,tvmaze,"Blue Bloods is a drama about a multi-generational family of cops dedicated to New York City law enforcement. Frank Reagan is the New York Police Commissioner and heads both the police force and the Reagan brood. He runs his department as diplomatically as he runs his family, even when dealing with the politics that plagued his unapologetically bold father, Henry, during his stint as Chief. A source of pride and concern for Frank is his eldest son Danny, a seasoned detective, family man and Iraq War vet who on occasion uses dubious tactics to solve cases with his loyal and tough partner, Detective Jackie Curatola. The Reagan women in the family include Erin, a N.Y. Assistant D.A., who also serves as the legal compass for her siblings and father, and single parent to her teenage daughter Nicky; and Linda, Danny's supportive wife. Jamie is the youngest Reagan, a recent grad of Harvard Law and the family's ""golden boy."" Unable to deny the family tradition, Jamie has decided to give up a lucrative future in law and follow in the family footsteps as a cop.",Blue Bloods,tvshow
685682fc8482e0a7a0072698,tvmaze_102,"Drama, Crime",8.3,2010-09-19,60,tvmaze,"As the country struggles to cope with the Great Depression and the end of Prohibition looms, Nucky Thompson looks to legitimize himself through alliances with liquor producers, while rivals Lucky Luciano and Meyer Lansky seek to consolidate their power in the wake of Arnold Rothstein's death and eliminate all competition - by any means necessary on Boardwalk Empire.",Boardwalk Empire,tvshow
685682fc8482e0a7a0072699,tvmaze_103,"Drama, Crime, Legal",7.9,1999-09-20,60,tvmaze,"In the criminal justice system, sexually-based offenses are considered especially heinous. In New York City, the dedicated detectives who investigate these vicious felonies are members of an elite squad known as the Special Victims Unit. These are their stories.",Law & Order: Special Victims Unit,tvshow
685682fc8482e0a7a007269a,tvmaze_106,"Drama, Crime, Western",8.7,2010-03-16,60,tvmaze,"Deputy U.S. Marshal Raylan Givens is something of a 19th century-style officer in modern times, whose unconventional enforcement of justice makes him a target with criminals and a problem for his superiors in the U.S. Marshals Service. As a result of an eager but ""justified"" shooting of a Miami fugitive while on assignment in Florida, Givens is reassigned to Lexington, Kentucky, in a district that includes his hometown of Harlan, a rural mining town in the east of the state.",Justified,tvshow
685682fc8482e0a7a007269b,tvmaze_108,"Comedy, Family",6.0,2014-10-05,30,tvmaze,"John Mulaney is a 29-year-old comedian working the stand-up circuit and looking for his big break. But life drastically changes when self-centered comedy legend and game show host Lou Cannon hires Mulaney as a writer. Lou may be John's entrée into the world of big-money show business, but he's also a total nightmare. Still, the job represents everything Mulaney thinks he wants. But does he really? And, at what cost? And what does it say about him if he quits? And what does it say about him if he stays? And has Lou had work done?",Mulaney,tvshow
685682fc8482e0a7a007269c,tvmaze_109,"Drama, Action, Crime",8.1,2000-10-06,60,tvmaze,"CSI: Crime Scene Investigation is a drama about a team of forensic investigators trained to solve criminal cases by scouring the crime scene, collecting irrefutable evidence and finding the missing pieces that solve the mystery.",CSI: Crime Scene Investigation,tvshow
685682fc8482e0a7a007269d,tvmaze_111,"Drama, Fantasy, Romance",7.5,2011-10-23,60,tvmaze,"Once Upon a Time is Fairy Tale Land. It's filled with magic, monsters and all of the characters we all know from stories growing up. It's real, and so are the people in it. But unlike the ""happily ever after"" you may have heard about, their stories continued, and The Evil Queen cast a Dark Curse over the land...This is Storybrooke. It's a quiet, little New England town filled with people who go about their everyday lives with no idea who they really are. The Queen's Curse has trapped them here and placed her in near-complete control. They have no real memories and no real hope.",Once Upon a Time,tvshow
685682fc8482e0a7a007269e,tvmaze_112,Comedy,8.4,1997-08-13,30,tvmaze,South Park is an adult comedy animation show centred around 4 children in the small town of south park. Its humour is often dark involving satirical elements and mocking current real-life events.,South Park,tvshow
685682fc8482e0a7a007269f,tvmaze_114,Adventure,7.3,2000-05-31,90,tvmaze,"Eighteen to twenty castaways will compete against each other on Survivor. All castaways will compete to outwit, outplay, outlast and ultimately be crowned Sole Survivor.",Survivor,tvshow
685682fc8482e0a7a00726a0,tvmaze_116,"Drama, Crime, Mystery",8.3,2008-09-23,60,tvmaze,"Patrick Jane, an independent consultant with the California Bureau of Investigation (CBI), has a remarkable track record for solving serious crimes by using his razor sharp skills of observation. Within the Bureau, Jane is notorious for his blatant lack of protocol and his semi-celebrity past as a psychic medium, whose paranormal abilities he now admits he feigned. No-nonsense Senior Agent Teresa Lisbon openly resists having Jane in her unit and alternates between reluctantly acknowledging Jane's usefulness and blasting him for his theatrics, narcissism, and dangerous lack of boundaries. Lisbon's team includes agents Kimball Cho, Wayne Rigsby and rookie member Grace Van Pelt, who all think Jane's a loose cannon but admire his charm and knack for clearing cases.",The Mentalist,tvshow
685682fc8482e0a7a00726a1,tvmaze_117,"Action, Adventure, Science-Fiction",7.9,2014-09-29,30,tvmaze,"Star Wars Rebels, set five years before the events of Star Wars: Episode IV - A New Hope, tells the story of the Rebellion's beginnings while the Empire spreads tyranny through the galaxy.",Star Wars: Rebels,tvshow
685682fc8482e0a7a00726a2,tvmaze_127,"Drama, Romance",7.6,2014-10-12,60,tvmaze,"At once deeply observed and intriguingly elusive, The Affair explores the emotional effects of an extramarital relationship.Noah is a New York City schoolteacher and novelist who is happily married, but resents his dependence on his wealthy father-in-law. Alison is a young waitress trying to piece her life and marriage back together in the wake of a tragedy. The provocative drama unfolds when Alison and Noah meet in Montauk at the end of Long Island.",The Affair,tvshow
685682fc8482e0a7a00726a3,tvmaze_128,"Drama, Crime, Romance",7.4,2014-10-13,60,tvmaze,"When Jane Villanueva was a young girl, her grandmother, Alba, convinced her of two things: telenovelas are the highest form of entertainment, and women must protect their virginity at all costs. Jane the Virgin, although she has always tried to be the good girl who does the right thing, Jane's life has suddenly become as dramatic and complicated as the telenovelas she has always loved.",Jane the Virgin,tvshow
685682fc8482e0a7a00726a4,tvmaze_130,Comedy,6.7,2003-09-22,30,tvmaze,"Charlie is a well-to-do bachelor with a house at the beach, a Jaguar in the front, and an easy way with women. His casual Malibu lifestyle is interrupted when his tightly wound brother Alan, who's facing a divorce, and his son Jake, come to live with him. Together, these two and a half men confront the challenges of growing up; finally. Complicating matters are the brothers' self-obsessed, controlling mother, Evelyn, Alan's estranged wife, Judith and Charlie's crazy neighbor Rose, who wants to be a part of his life and is willing to do anything to be around. After the death of his brother, Alan Harper meets and befriends a lonely young man named Walden Schmidt who turns out to be a billionaire. Unable to afford his brother's home, Alan sells Walden the house, and as a way of showing his gratitude, Walden allows Alan and his son Jake to move in with him.",Two and a Half Men,tvshow
685682fc8482e0a7a00726a5,tvmaze_133,"Drama, Crime, Mystery",8.3,2012-09-27,60,tvmaze,"Elementary is a modern-day take on the classic Sherlock Holmes story about a crime-solving duo that cracks the NYPD's most impossible cases. Following his fall from grace in London and a stint in rehab, eccentric Sherlock escapes to Manhattan where his wealthy father forces him to live with his worst nightmare - a sober companion, Dr. Watson.",Elementary,tvshow
685682fc8482e0a7a00726a6,tvmaze_138,"Drama, Science-Fiction, Thriller",7.9,2014-06-29,60,tvmaze,"Three years after millions of people—some 2% of the world's population—vanished into thin air, residents of Mapleton, NY weigh the pros and cons of a ""Heroes Day"" tribute to the local ""Departed"". Attempting to maintain a sense of normalcy in his strained community, police chief Kevin Garvey faces additional challenges at home with his daughter, Jill, who's lost in a cloud of apathy with her friend Aimee, and son, Tom, who has gravitated to a cult led by the charismatic Holy Wayne. Also of concern is a silent, white-clad group of chain-smoking men and women called the Guilty Remnant, who team up in pairs to stake out people and places around town. As tension in Mapleton escalates, the lives of Laurie, an unexpected member of the Guilty Remnant, and Meg, a recently engaged young woman, converge.",The Leftovers,tvshow
685682fc8482e0a7a00726a7,tvmaze_141,"Comedy, Medical",6.9,2013-11-24,30,tvmaze,"From creators Mark V. Olsen and Will Scheffer, the series follows the daily lives of nurses and doctors as they struggle with the darkly comic realities of caring for the elderly in an overwhelmed healthcare system, skewering the petty bureaucracies of modern medical practice in America.",Getting On,tvshow
685682fc8482e0a7a00726a8,tvmaze_142,Comedy,7.9,2012-04-22,30,tvmaze,"Former Senator Selina Meyer has accepted the call to serve as Vice President of the United States. The job is nothing like she imagined and everything she was warned about. Veep follows Meyer and her staff as they attempt to make their mark and leave a lasting legacy, without getting tripped up in the day-to-day political games that define Washington.",Veep,tvshow
685682fc8482e0a7a00726a9,tvmaze_143,Comedy,8.4,2014-04-06,30,tvmaze,"In the high-tech gold rush of modern Silicon Valley, the people most qualified to succeed are the least capable of handling success. From Mike Judge comes this satire about a programmer whose game-changing algorithm becomes the subject of a valley-wide bidding war.",Silicon Valley,tvshow
685682fc8482e0a7a00726aa,tvmaze_144,Comedy,8.0,2005-06-05,30,tvmaze,"The limited comedy series stars Lisa Kudrow as the embattled Valerie Cherish, a fading TV ""It Girl"" who was once so desperate to stay in the spotlight that she allowed cameras to follow her every move as she appeared on a new sitcom - with disastrous results. Now, it's ten years later, and Valerie thinks she has it all figured out this time. She doesn't.",The Comeback,tvshow
685682fc8482e0a7a00726ab,tvmaze_145,"Drama, Comedy",7.9,2012-01-08,30,tvmaze,"Charming, fast talking Marty Kaan and his crack team of management consultants know how to play the corporate game better than anyone, by using every dirty trick in the book to woo powerful CEOs and close huge deals. In the board rooms, barrooms, and bedrooms of the power elite, corruption is business as usual and everyone's out for themselves first. Nothing is sacred in this scathing, irreverent satire of corporate America today.",House of Lies,tvshow
685682fc8482e0a7a00726ac,tvmaze_147,"Drama, Comedy",7.9,2009-06-08,30,tvmaze,"Every day is a matter of life and death in a hectic New York City hospital, but for Nurse Jackie that's the easiest part. Between chronic back pain that won't quit, and a personal life on the constant edge of collapse, it's going to take a white lie here, a bent rule there, and a handful of secret strategies to relieve the pain, and stay one step ahead of total disaster.",Nurse Jackie,tvshow
685682fc8482e0a7a00726ad,tvmaze_151,Drama,8.4,2012-06-24,60,tvmaze,"The Newsroom follows the members of a cable news team on their quixotic mission to do the news well in the face of a fickle audience, corporate mandates and tangled personal relationships.",The Newsroom,tvshow
685682fc8482e0a7a00726ae,tvmaze_158,"Drama, Action, Science-Fiction",8.7,2008-09-09,60,tvmaze,"When an international flight lands at Boston's Logan Airport and the passengers and crew have all died grisly deaths, FBI Special Agent Olivia Dunham is called in to investigate. After her partner is nearly killed during the investigation, a desperate Olivia searches frantically for someone to help, leading her to Dr. Walter Bishop, our generation's Einstein. There's only one catch: he's been institutionalized for the last twenty years, and the only way to question him requires pulling his estranged son Peter in to help. When Olivia's investigation leads her to a manipulative corporate executive, she and her team will discover that what happened on Flight 627 is only a small piece of a larger, more shocking truth and will explore the blurring line between the possible and the impossible.",Fringe,tvshow
685682fc8482e0a7a00726af,tvmaze_159,"Drama, Thriller",6.5,2014-11-17,60,tvmaze,"Each day the President is faced with dozens of life and death decisions, and to prioritize the biggest international crises facing the country, one top CIA analyst — Charleston Tucker — assembles the President's Daily Briefing (PDB). This list of the most vital security issues facing the nation brings with it moral and political judgment calls for Charleston and... her trusted group of brilliant analysts at the agency. Aside from the political minefields she has to walk, Charlie has a close personal relationship with the President because she was once engaged to her son before a tragic terrorist attack took his life. Charlie survived that attack and is now determined to bring the perpetrators to justice. Navigating a complex personal life and a pressure-cooker profession is, of course, a challenge, and Charlie sometimes engages in boundary-pushing behavior to avoid facing her grief. But when the clock strikes 2 a.m., she is all about her job — protecting her nation, serving her President and still trying to get to the bottom of her fiancé's murder that will reveal itself as a shocking mystery.",State of Affairs,tvshow
685682fc8482e0a7a00726b0,tvmaze_161,"Drama, Crime, Mystery",8.4,2006-10-01,60,tvmaze,"He's smart, he's good looking, and he's got a great sense of humor. He's Dexter Morgan, everyone's favorite serial killer. As a Miami forensics expert, he spends his days solving crimes, and nights committing them. But Dexter lives by a strict code of honor that is both his saving grace and lifelong burden. Torn between his deadly compulsion and his desire for true happiness, Dexter is a man in profound conflict with the world and himself.",Dexter,tvshow
685682fc8482e0a7a00726b1,tvmaze_163,"Action, Adventure, Crime",8.0,2010-01-17,60,tvmaze,"Christopher Chance is a unique private contractor/security expert/bodyguard hired when an unusual or imminent threat cannot be solved through normal means of protection. Chance works with his business partner and trusted friend, Winston, and hired gun, Guerrero, to integrate himself completely into his clients' lives and eliminate the threat by becoming the Human Target.",Human Target,tvshow
685682fc8482e0a7a00726b2,tvmaze_164,"Drama, Action, Crime",8.6,2013-01-11,60,tvmaze,"Banshee stars Antony Starr as Lucas Hood, an ex-con and master thief who assumes the identity of the sheriff of Banshee, Pennsylvania, where he continues his criminal activities, even as he's hunted by the shadowy gangsters he betrayed years earlier.",Banshee,tvshow
685682fc8482e0a7a00726b3,tvmaze_168,"Drama, Comedy, Action",8.3,2007-09-24,60,tvmaze,"Chuck Bartowski is a computer geek that gets catapulted into a new career as the government's most vital secret agent. When Chuck opens an e-mail subliminally encoded with government secrets, he unwittingly downloads an entire server of sensitive data into his brain. With the government's most precious secrets in Chuck's head, Major John Casey of the National Security Agency assumes the responsibility of protecting him. His partner is the CIA's top agent, Sarah Walker.",Chuck,tvshow
685682fc8482e0a7a00726b4,tvmaze_169,"Drama, Crime, Thriller",9.2,2008-01-20,60,tvmaze,"Breaking Bad follows protagonist Walter White, a chemistry teacher who lives in New Mexico with his wife and teenage son who has cerebral palsy. White is diagnosed with Stage III cancer and given a prognosis of two years left to live. With a new sense of fearlessness based on his medical prognosis, and a desire to secure his family's financial security, White chooses to enter a dangerous world of drugs and crime and ascends to power in this world. The series explores how a fatal diagnosis such as White's releases a typical man from the daily concerns and constraints of normal society and follows his transformation from mild family man to a kingpin of the drug trade.",Breaking Bad,tvshow
685682fc8482e0a7a00726b5,tvmaze_170,"Drama, Comedy, Crime",7.9,2013-07-11,0,tvmaze,"Orange Is the New Black is the story of Piper Chapman, a woman in her thirties who is sentenced to fifteen months in prison after being convicted of a decade-old crime of transporting money for her drug-dealing girlfriend.",Orange Is the New Black,tvshow
685682fc8482e0a7a00726b6,tvmaze_171,"Drama, Comedy, Romance",7.9,2005-09-19,30,tvmaze,"How I Met Your Mother is a comedy about Ted and how he fell in love. It all starts when Ted's best friend, Marshall drops the bombshell that he's going to propose to his long-time girlfriend, Lilya kindergarten teacher. At that moment, Ted realizes that he had better get a move on if he too hopes to find true love. Helping him in his quest is Barney a friend with endless, sometimes outrageous opinions, a penchant for suits and a foolproof way to meet women. When Ted meets Robin he's sure it's love at first sight, but destiny may have something else in store.",How I Met Your Mother,tvshow
685682fc8482e0a7a00726b7,tvmaze_178,"Action, Adventure, Fantasy",8.0,2012-04-14,30,tvmaze,Avatar Korra fights to keep Republic City safe from the evil forces of both the physical and spiritual worlds.,The Legend of Korra,tvshow
685682fc8482e0a7a00726b8,tvmaze_183,"Drama, Thriller",7.8,2014-06-24,60,tvmaze,Tyrant is a drama that follows a typical American family whose members find themselves embroiled in the geopolitical intrigue of a volatile Middle Eastern country. Barry Al-Fayeed is a California pediatrician who also happens to be the second son of a Middle Eastern dictator. Barry reluctantly agrees to return home with his American family for his nephew's wedding. Events thrust him into the complex and turbulent growing pains of a nation straining to break free from dictatorial rule.,Tyrant,tvshow
685682fc8482e0a7a00726b9,tvmaze_187,"Action, Science-Fiction",6.7,2014-01-07,60,tvmaze,"Intelligence is a dramatic thriller about a high-tech intelligence operative enhanced with a super-computer microchip in his brain. With this implant, Gabriel Vaughn is the first human ever to be connected directly into the worldwide information grid and have complete access to Internet, WiFi, telephone and satellite data. He can hack into any data center and access key Intel in the fight to protect the United States from its enemies. Leading the elite government cyber-security agency created to support him is Director Lillian Strand, a straightforward and efficient boss who oversees the unit's missions. Strand assigns Riley Neal, a Secret Service agent, to protect Gabriel from outside threats, as well as from his appetite for reckless, unpredictable behavior and disregard for protocol. Other skilled members of the Cybercom team include Chris Jameson and Gonzalo ""Gonzo"" Rodriguez two resourceful federal investigators. The brains behind the design of the chip is Dr. Shenendoah Cassidy, whose son, Nelson is jealous of Gabriel's prominent place in his father's life. As the first supercomputer with a beating heart, Gabriel is the most valuable piece of technology the country has ever created and is the U.S.'s secret weapon.",Intelligence,tvshow
685682fc8482e0a7a00726ba,tvmaze_191,Drama,8.2,2014-06-01,60,tvmaze,"Halt and Catch Fire is set roughly one year after IBM all but corners the market with the release of its first major product – the IBM PC. In this fictional drama, a former IBM executive, Joe MacMillan plans to reverse engineer the flagship product of his former employer and forces his current company, Cardiff Electric, into the personal computer race. MacMillan enlists the help of Gordon Clark, a great engineer whose unrealized dreams of creating a revolutionary product have created tension in his marriage to Donna, and Cameron Howe, a volatile prodigy who puts her future in jeopardy to join MacMillan's rogue PC project. Halt and Catch Fire thrives on the spirit of innovation and explores what it's like to stand at the forefront of something world-changing and work towards it, no matter the risk.",Halt and Catch Fire,tvshow
685682fc8482e0a7a00726bb,tvmaze_194,"Drama, Crime, Horror",8.3,2013-04-04,60,tvmaze,"Criminal profiler Will Graham is tasked by FBI agent Jack Crawford, the head of Behavioral Sciences, to help investigate the disappearances of eight young girls across Minnesota. Graham and Crawford's team investigate several subsequent murders, while also trying to catch the Chesapeake Ripper. With the investigation weighing heavily on Graham, Crawford decides to have him supervised by psychiatrist Dr. Hannibal Lecter, who, unbeknownst to them, is the Chesapeake Ripper himself, actively seeking to derail the investigation.",Hannibal,tvshow
685682fc8482e0a7a00726bc,tvmaze_195,"Drama, Horror, Thriller",7.9,2013-03-18,60,tvmaze,"Bates Motel is a contemporary prequel to the genre-defining film Psycho, and gives viewers an intimate portrayal of how Norman Bates' psyche unravels through his teenage years.Following the tragic death of her husband, Norma Bates buys a motel on the outskirts of the idyllic coastal town of White Pine Bay, seeking a fresh start. As Norma and Norman get ensconced in their new home, they discover this town isn't quite what it seems, and the locals aren't so quick to let them in on their secrets. But the Bates' are done being pushed around and will do whatever it takes to survive - and will do whatever it takes to protect their own secrets.",Bates Motel,tvshow
685682fc8482e0a7a00726bd,tvmaze_196,"Drama, Crime, Thriller",7.0,2013-01-21,60,tvmaze,"The FBI estimates there are currently over 300 active serial killers in the United States. What would happen if these killers had a way of communicating and connecting with each other? What if they were able to work together and form alliances across the country? What if one brilliant psychotic serial killer was able to bring them all together and activate a following? Welcome to The Following, a terrifying new thriller.",The Following,tvshow
685682fc8482e0a7a00726be,tvmaze_198,"Drama, Family, Romance",7.5,2013-06-03,60,tvmaze,"The Fosters is a critically-acclaimed series that centers on biracial lesbian couple Stef and Lena Foster, who are raising a multi-ethnic family mix of foster and biological kids. The second season will continue to explore the growing Fosters clan, with all the triumphs and travails, twists and turns, that fans of the series have come to expect. Callie and Jude will try to adjust to their new roles in the family, and everyone will deal with the fallout from their previous actions. Past mistakes will come home to roost, consequences will be handed out, and victories will be hard fought, and ultimately well-won. Their deep bonds will grow, enabling America's most modern family to face the future head on, with love in their hearts.",The Fosters,tvshow
685682fc8482e0a7a00726bf,tvmaze_199,"Drama, Romance",7.8,2013-06-03,60,tvmaze,"Based on the hit UK television series of the same name, Mistresses is a provocative and thrilling drama about the scandalous lives of a sexy and sassy group of four girlfriends, each on her own path to self-discovery. These four friends find support and guidance with each other as they brave their turbulent journeys and life's storms of excitement, secrecy and betrayal, all the while bound by the complex relationships they've created.",Mistresses,tvshow
