_id,id,genres,rating,release_date,runtime,source,summary,title,type
685682fc8482e0a7a0072623,tvmaze_234,"Drama, Action, Thriller",6.8,2012-03-15,60,tvmaze,"Becca Winstone learns that her son, Michael, disappears while studying abroad, and it's a race against time when she travels to Europe to track him down. A surprising turn of events reveals just how far one mother will go to protect her family. Exotic locations and thrilling twists will keep you riveted in Missing. How far would you go to save the only thing you have left in the world? At 8 years old, Michael watched as his father, CIA Agent Paul Winstone, was murdered. Now 10 years later, Paul's wife, Becca, is faced with the reality of her son growing up. When Michael is afforded the opportunity to study abroad, his mother reluctantly agrees it's time to let him go. Just a few weeks into his trip Michael disappears, and Becca immediately suspects foul play. When she arrives in Rome, she begins piecing together the clues left behind. It isn't long before the kidnappers realize they've picked a fight with the wrong woman. Becca Winstone has a secret of her own -- before Paul's death, she was also a lethal CIA Agent. But if she wants to find her son alive, Becca will have to rely on old friends and reopen old wounds. Her resourcefulness, skill and determination will be put to the test - but a mother's love knows no limits.",Missing,tvshow
685682fc8482e0a7a0072624,tvmaze_236,"Drama, Comedy, Romance",7.3,2012-03-04,60,tvmaze,"Amanda Vaughn once the ultimate high school ""mean girl"", is forced to return home in disgrace after her marriage ends in scandal. Amanda is nothing like the girl she was 20 years ago, but as her old classmates reacquaint themselves with the new Amanda, will her home town welcome her with open arms or seek revenge? No one in this town is a saint, but that doesn't mean they can't have a heart. As Amanda and her teenage kids try to adjust to their new lives, the ladies from her past alternate between sympathy and scheming.",GCB,tvshow
685682fc8482e0a7a0072625,tvmaze_237,"Action, Adventure, Science-Fiction",7.5,2012-09-17,60,tvmaze,"What would you do without it all? In this epic adventure, a family struggles to reunite in an American landscape void of electricity: a world of empty cities, local militias and heroic freedom fighters, where every single piece of technology -- computers, planes, cars, phones, even lights -- has mysteriously blacked out forever.",Revolution,tvshow
685682fc8482e0a7a0072626,tvmaze_238,"Drama, Family",6.5,2012-06-13,60,tvmaze,"Dallas follows Bobby Ewing, now the senior member of the Ewing family following the death of his older brother J.R. Ewing. Following the death of his revered father, John Ross is out to prove he can be just as powerful an ally or enemy as his infamous father. Bobby's adopted son Christopher is newly single and determined to make a name for himself and his family in the world of natural gas. Elena Ramos is the former girlfriend of both John Ross and Christopher who is now blinded by thoughts of justice for previous wrongs. Pamela Rebecca Barnes is John Ross' wife and the daughter of Cliff Barnes, a longtime rival of the Ewings. She is determined to have a happy ending with her husband and make a home on Southfork Ranch. Also featured is Bobby's wife Ann and Harris Ryland, her scheming ex-husband. Emma Ryland is Ann and Harris' daughter, who has been taught by her father and grandmother.",Dallas,tvshow
685682fc8482e0a7a0072627,tvmaze_239,Comedy,6.5,2012-06-28,30,tvmaze,"In Anger Management, Charlie is a non-traditional therapist specializing in anger management. He has a successful private practice, holding sessions with his group of primary patients each week, as well as performing pro-bono counseling for an inmate group at a state prison.",Anger Management,tvshow
685682fc8482e0a7a0072628,tvmaze_244,"Drama, Western",7.2,2014-10-06,60,tvmaze,"Strange Empire is a Western whose heroes are women. With most of their men gone, and those who remain battling for control, the women struggle to survive, to find their independence, and to build a life in which to thrive and raise families. As the stories of Janestown's citizens unfold we see the clash between a power-hungry father and son and the deep prejudices among races, but also the start of something akin to community in this Wild West. Western stories take civilization as a goal; they begin in blood, and end in the morality of Main Street.",Strange Empire,tvshow
685682fc8482e0a7a0072629,tvmaze_4,"Drama, Action, Science-Fiction",7.4,2012-10-10,60,tvmaze,"After a violent shipwreck, billionaire playboy Oliver Queen was missing and presumed dead for five years before being discovered alive on a remote island in the Pacific. He returned home to Starling City, welcomed by his devoted mother Moira, beloved sister Thea and former flame Laurel Lance. With the aid of his trusted chauffeur/bodyguard John Diggle, the computer-hacking skills of Felicity Smoak and the occasional, reluctant assistance of former police detective, now beat cop, Quentin Lance, Oliver has been waging a one-man war on crime.",Arrow,tvshow
685682fc8482e0a7a007262a,tvmaze_7,"Drama, Thriller, Espionage",8.2,2011-10-02,60,tvmaze,"The winner of 6 Emmy Awards including Outstanding Drama Series, Homeland is an edge-of-your-seat sensation. Marine Sergeant Nicholas Brody is both a decorated hero and a serious threat. CIA officer Carrie Mathison is tops in her field despite being bipolar. The delicate dance these two complex characters perform, built on lies, suspicion, and desire, is at the heart of this gripping, emotional thriller in which nothing short of the fate of our nation is at stake.",Homeland,tvshow
685682fc8482e0a7a007262b,tvmaze_16,"Horror, Thriller, Supernatural",8.2,2014-05-11,60,tvmaze,"Some of literature's most terrifying characters, including Dr. Frankenstein and his monster, Dorian Gray, and iconic figures from the novel Dracula are lurking in the darkest corners of Victorian London. They are joined by a core of original characters in a complex, frightening new narrative. Penny Dreadful is a psychological thriller filled with dark mystery and suspense, where personal demons from the past can be stronger than vampires, evil spirits and immortal beasts.",Penny Dreadful,tvshow
685682fc8482e0a7a007262c,tvmaze_18,"Action, Adventure, Family",6.9,2001-09-05,90,tvmaze,"From athletes and actors to tattoo artists, social workers and musicians - a diverse mix of teams will need to utilize their street smarts and savvy know-how to compete in the race of their lifetime.",The Amazing Race,tvshow
685682fc8482e0a7a007262d,tvmaze_20,"Drama, Horror, Thriller",7.4,2014-07-13,60,tvmaze,"The Strain is a high-concept thriller that tells the story of Dr. Ephraim Goodweather, the head of the Center for Disease Control Canary Team in New York City. He and his team are called upon to investigate a mysterious viral outbreak with hallmarks of an ancient and evil strain of vampirism. As the strain spreads, Goodweather, his team, and an assembly of everyday New Yorkers wage war for the fate of humanity itself.",The Strain,tvshow
685682fc8482e0a7a007262e,tvmaze_24,"Drama, Action, Crime",7.7,2010-09-20,60,tvmaze,"Hawaii Five-0 is a contemporary take on the classic series about a new elite federalized task force whose mission is to wipe out the crime that washes up on the Islands' sun-drenched beaches. Detective Steve McGarrett, a decorated Naval officer-turned-cop, returned to Oahu to investigate his father's murder and stayed after Hawaii's former governor persuaded him to head up the new team: his rules, no red tape and full blanket authority to hunt down the biggest ""game"" in town. Joining McGarrett is Detective Danny ""Danno"" Williams, a relocated ex-New Jersey cop - a working man in paradise who prefers skyscrapers to the coastline - but who's committed to keeping the Islands safe for his young daughter; Chin Ho Kelly, an ex-Honolulu police detective and former protégé of McGarrett's father who was wrongly accused of corruption; Dr. Max Bergman, the quirky coroner; Chin's cousin, Kono Kalakaua, a beautiful and fearless native; and Captain Lou Grover, who formerly headed Hawaii's SWAT unit. Joining them is Jerry Ortega, a former classmate of Chin's and the Island's local conspiracy theorist. The state's brash FIVE-0 unit, who may spar and jest among themselves, remain determined to eliminate the seedy elements from the 50th state.",Hawaii Five-0,tvshow
685682fc8482e0a7a007262f,tvmaze_25,"Anime, Horror, Supernatural",7.3,2001-10-10,30,tvmaze,Hellsing is a 13-part anime based on the manga of the same name. The plot is significantly difficult to that of the the manga although the characters are the same. The show mainly focuses on the hellsing institute that houses the anti-hero named Alucard who swore loyalty to the Helsing family many years before. Alucard being the first ever vampire takes on a new apprentice named Sera's.,Hellsing,tvshow
685682fc8482e0a7a0072630,tvmaze_28,"Drama, Comedy",7.8,2007-08-13,30,tvmaze,Californication is a series based around the writer Hank Moody. He moves to California and suffers a writers block as well as many other family and personal issues. His drinking and generally unhealthy lifestyle interrupts his relationships with his long term lover Karen and his daughter Becca as he struggles with his manager Charlie Runkle.,Californication,tvshow
685682fc8482e0a7a0072631,tvmaze_29,"Drama, Action, History",8.6,2013-03-03,60,tvmaze,"Vikings transports us to the brutal and mysterious world of Ragnar Lothbrok, a Viking warrior and farmer who yearns to explore - and raid - the distant shores across the ocean.",Vikings,tvshow
685682fc8482e0a7a0072632,tvmaze_30,"Drama, Horror, Thriller",7.5,2011-10-05,60,tvmaze,"American Horror Story is an horror television anthology series. Each season is conceived as a self-contained miniseries, following a disparate set of characters and settings, and a storyline with its own beginning, middle, and end. While some actors appear for more than one year, they play completely different roles in each season.",American Horror Story,tvshow
685682fc8482e0a7a0072633,tvmaze_44,"Drama, Action, Thriller",7.3,2014-09-22,60,tvmaze,"Scorpion, inspired by a true story, is a high-octane drama about eccentric genius Walter O'Brien and his team of brilliant misfits who comprise the last line of defense against complex, high-tech threats of the modern age. As Homeland Security's new think tank, O'Brien's ""Scorpion"" team includes Toby Curtis an expert behaviorist who can read anyone; Happy Quinn, a mechanical prodigy; and Sylvester Dodd, a statistics guru. Pooling their extensive technological knowledge to solve mind-boggling predicaments amazes federal agent Cabe Gallo, who shares a harrowing history with O'Brien. However, while this socially awkward group is comfortable with each other's humor and quirks, life outside their circle confounds them, so they rely on Paige Dineen, who has a young, gifted son, to translate the world for them. At last, these nerdy masterminds have found the perfect job: a place where they can apply their exceptional brainpower to solve the nation's crises, while also helping each other learn how to fit in.",Scorpion,tvshow
685682fc8482e0a7a0072634,tvmaze_47,"Drama, Fantasy, Romance",7.5,2013-10-06,60,tvmaze,"Based on Melissa de la Cruz's best-selling novel, Witches of East End centers on the mysterious Beauchamp family who live in the secluded seaside town of East End. Free-spirited artist Joanna Beauchamp is the mother of wild-child bartender Freya and shy librarian Ingrid, who are both gifted -- and cursed -- with a magic birthright, of which they are unaware. Freya notices bizarre occurrences in her life when she inexplicably finds herself drawn to the troubled brother of her wealthy fiance. But it isn't until Joanna's estranged sister appears with a warning that could change the family's fate that the matriarch must reveal to her daughters that they are immortal witches with untapped powers, a revelation that turns their small-town life upside down.",Witches of East End,tvshow
685682fc8482e0a7a0072635,tvmaze_51,"Drama, Medical",8.3,2014-08-08,60,tvmaze,"New York City, 1900: The Knickerbocker Hospital is home to groundbreaking surgeons, nurses and staff who push the boundaries of medicine in a time of astonishingly high mortality rates and zero antibiotics. The newly appointed leader of the surgery staff is the brilliant, arrogant renegade Dr. John Thackery, whose addiction to cocaine and opium is trumped only by his ambition for medical discovery and renown among his peers. Into the all-white staff and patient hospital comes the equally gifted Harvard graduate Dr. Algernon Edwards, who must fight for respect while trying to navigate the racially charged city. Trying to maintain its reputation for quality care while realizing a profit, the Knickerbocker makes an effort to attract wealthy clientele, while literally struggling to keep the lights on.",The Knick,tvshow
685682fc8482e0a7a0072636,tvmaze_54,"Drama, Crime, Thriller",7.5,2014-08-13,60,tvmaze,"Sean Bean stars in Legends, a suspense-filled drama based on the award-winning book by master spy novelist Robert Littell. Bean plays Martin Odum, an undercover agent working for the FBI's Deep Cover Operations (DCO) division. Martin has the uncanny ability to transform himself into a completely different person for each job. But he begins to question his own identity when a mysterious stranger suggests that Martin isn't the man he believes himself to be.",Legends,tvshow
685682fc8482e0a7a0072637,tvmaze_64,"Drama, Science-Fiction, Thriller",8.3,2013-01-15,60,tvmaze,Utopia based initially around a small group of people who find a rare manuscript of the same name. This leads the group to be targeted by a large organisation with little knowledge of the manuscript's relevance or importance.,Utopia,tvshow
685682fc8482e0a7a0072638,tvmaze_71,Family,5.8,2005-06-01,120,tvmaze,The hit series in which celebrities perform choreographed dance routines that are judged by a panel of renowned ballroom experts,Dancing with the Stars,tvshow
685682fc8482e0a7a0072639,tvmaze_76,"Drama, Action, Crime",8.3,2008-09-03,60,tvmaze,"Sons of Anarchy is an American television drama series created by Kurt Sutter, about the lives of a close-knit outlaw motorcycle club operating in Charming, a fictional town in California's Central Valley. The show centers on protagonist Jackson ""Jax"" Teller (Charlie Hunnam), initially the vice president of the club, who begins questioning the club and himself.",Sons of Anarchy,tvshow
685682fc8482e0a7a007263a,tvmaze_82,"Drama, Adventure, Fantasy",8.9,2011-04-17,60,tvmaze,"Based on the bestselling book series A Song of Ice and Fire by George R.R. Martin, this sprawling new HBO drama is set in a world where summers span decades and winters can last a lifetime. From the scheming south and the savage eastern lands, to the frozen north and ancient Wall that protects the realm from the mysterious darkness beyond, the powerful families of the Seven Kingdoms are locked in a battle for the Iron Throne. This is a story of duplicity and treachery, nobility and honor, conquest and triumph. In the Game of Thrones, you either win or you die.",Game of Thrones,tvshow
685682fc8482e0a7a007263b,tvmaze_86,"Crime, Thriller",7.3,2014-10-01,60,tvmaze,"Stalker is a psychological thriller about detectives who investigate stalking incidents - including voyeurism, cyber harassment and romantic fixation - for the Threat Assessment Unit of the LAPD. Det. Jack Larsen is a recent transfer to the Unit from New York City's homicide division, whose confidence, strong personality and questionable behavior has landed him in trouble before - but whose past behavior may also prove valuable in his new job. His boss, Lt. Beth Davis, is strong, focused and an expert in the field, driven by her traumatic personal experience as a victim. With the rest of their team, young but eager Det. Ben Caldwell and deceptively smart Det. Janice Lawrence Larsen and Davis assess the threat level of cases and respond before the stalking and intimidation spirals out of control, all while trying to keep their personal obsessions at bay.",Stalker,tvshow
685682fc8482e0a7a007263c,tvmaze_87,"Drama, Crime, Thriller",7.5,2013-07-10,60,tvmaze,"When the body of a cartel member is found on US soil, Sonya Cross from El Paso PD and her Mexican counterpart, Marco Ruiz must work together to solve the case.A present-day crime thriller exploring the tensions on the US-Mexico border. When an American judge known for her anti-immigration views is found dead on the bridge connecting El Paso and Juarez, Sonya Cross from El Paso PD must work with her Mexican counterpart from Chihuahua State Police, Marco Ruiz, to catch a serial killer operating on both sides of the border. Marco understands the slippery politics of Mexican law enforcement, and while his police force slowly succumbs to the pressures and demands of the cartel, he's one of the last good men in the department. He's charming but will do whatever it takes to get what he needs -- which doesn't sit well with Sonya, who has Asperger's and strictly follows rules and protocol. The case quickly pulls them into a string of murders on the border, a scene already consumed by illegal immigration, drug trafficking, violence, and prostitution.",The Bridge,tvshow
685682fc8482e0a7a007263d,tvmaze_90,"Drama, Crime, Supernatural",8.0,2010-07-09,60,tvmaze,"When FBI Special Agent Audrey Parker is dispatched to the small town of Haven, Maine, on a routine case, she soon finds herself increasingly involved in the return of ""The Troubles"", a plague of supernatural afflictions that have occurred in the town at least twice before. With an openness to the possibility of the paranormal, she also finds a more personal link in Haven that may lead her to the mother she has never known.She and her partner, police detective Nathan Wuornos, find themselves frequently facing problems caused by both the effects of the Troubles, as well as the activities of town folk who take more drastic measures against those who are Troubled.",Haven,tvshow
685682fc8482e0a7a007263e,tvmaze_95,"Drama, Action, Science-Fiction",7.6,2011-06-19,60,tvmaze,"The series tells the story of the aftermath of a global invasion by several races of extraterrestrials that neutralizes the world's power grid and technology, quickly destroys the combined militaries of all the world's countries, and apparently kills over 90% of the human population within a few days.",Falling Skies,tvshow
685682fc8482e0a7a007263f,tvmaze_101,"Drama, Crime, Legal",8.1,2009-09-22,60,tvmaze,"The Good Wife follows Alicia Florrick, a wife and mother who boldly assumes full responsibility for her family and re-enters the workforce after her husband's very public sex and political corruption scandal lands him in jail. Pushing aside the betrayal and crushing public humiliation caused by her husband Peter, Alicia starts over by pursuing her original career as a defense attorney.",The Good Wife,tvshow
685682fc8482e0a7a0072640,tvmaze_105,"Action, Crime, Horror",6.6,2014-03-11,60,tvmaze,"From Dusk Till Dawn: The Series, based on the thrill-ride film of the same name, is a supernatural crime saga centered around bank robber, Seth Gecko and his violent, unpredictable brother, Richard ""Richie"" Gecko, who are wanted by the FBI and Texas Rangers Earl McGraw and Freddie Gonzalez after a bank heist leaves several people dead. While on the run to Mexico, Seth and Richie encounter former pastor Jacob Fuller and his family, whom they take hostage. Using the family RV to cross the border, chaos ensues when the group detours to a strip club that is populated by vampires. They are forced to fight until dawn in order to get out alive.",From Dusk Till Dawn: The Series,tvshow
685682fc8482e0a7a0072641,tvmaze_107,"Comedy, Family",8.1,2011-01-09,30,tvmaze,"The series follows Bob who runs Bob's Burgers, with the help of his wife and their three kids. Bob has big ideas about burgers, but the rest of the clan falls short on service. Despite the greasy counters and lousy location, the Belchers are determined to make every ""Grand Re-Re-Re-opening"" a success. Bob's wife, Linda, stands by her man and often does so by bursting into song. Their eldest daughter, 13-year-old Tina has a slight obsession with boys and zombies. Middle child Gene is an aspiring musician with a thirst for life. Louise is the bunny ears-wearing youngest daughter with an off-kilter sense of humor that makes her somewhat of a liability in the kitchen – and with the public.",Bob's Burgers,tvshow
685682fc8482e0a7a0072642,tvmaze_115,Comedy,7.6,1997-01-12,0,tvmaze,"King of the Hill follows the life of Hank Hill, his wife Peggy, their 13-year-old son Bobby, their 18-year-old niece Luanne, her husband Lucky, their newborn baby girl Gracie and his beer guzzling neighborhood buddies, Dale, Bill and Boomhauer.",King of the Hill,tvshow
685682fc8482e0a7a0072643,tvmaze_120,"Drama, Comedy",7.3,2014-09-26,0,tvmaze,"In Transparent, an LA family with serious boundary issues have their past and future unravel when a dramatic admission causes everyone's secrets to spill out.",Transparent,tvshow
685682fc8482e0a7a0072644,tvmaze_124,Comedy,7.2,2011-09-19,30,tvmaze,"2 Broke Girls is a comedy about two young women waitressing at a greasy spoon diner who strike up an unlikely friendship in the hopes of launching a successful business - if only they can raise the cash. Sassy, streetwise Max Black works two jobs just to get by, one of which is waiting tables during the night shift at the retro-hip Williamsburg Diner. Sophisticated Caroline Channing is an uptown trust fund princess who's having a run of bad luck that forces her to reluctantly give waitressing a shot. At first, Max sees Caroline as yet another in a long line of inept servers she must cover for, but she's surprised to find that Caroline has as much substance as she does style.When Caroline discovers Max's knack for baking amazing cupcakes, she sees a lucrative future for them, but first they need to raise the start-up money. While they save their tips, they'll stay at the restaurant, working with Oleg, an overly flirtatious Russian cook; Earl, a 75-year-old kool-kat cashier; and Han Lee, the new, eager-to-please owner of the diner. Working together, these two broke girls living in one expensive city might just find the perfect recipe for their big break.",2 Broke Girls,tvshow
685682fc8482e0a7a0072645,tvmaze_125,"Comedy, Romance",7.1,2014-09-30,30,tvmaze,"Eliza Dooley has 263,000 followers who hang on to her every post, tweet and selfie. But one lonely day, she has a revelation: being friended is not the same as having actual friends. She asks marketing guru Henry to 'rebrand' her self-obsessed reputation and teach her how to connect with people in the real world. Loosely based on My Fair Lady, Selfie explores the modern struggles of Eliza and Henry, as he tries to teach her how to live life offline - whether she 'likes' it or not.",Selfie,tvshow
685682fc8482e0a7a0072646,tvmaze_126,"Comedy, Family",7.7,2013-09-23,30,tvmaze,"Christy is a single mom who, after years of questionable choices, is now sober and trying to get her life on track. She's tested daily by her newly sober mother, Bonnie, who is trying to make up for all the ways she's let Christy down. Christy is further challenged by her relationships with her own kids. Her daughter Violet is engaged to a man twice her age and her ten-year-old son, Roscoe, would rather live with his father Baxter, a former slacker who has only recently gotten himself together. To help her stay sober, Christy relies on her support system from AA, comprised of her sponsor Marjorie, her wealthy sponsee, Jill, and her emotional friend, Wendy. Christy tries to remain positive as she attempts to overcome her past and build a better future, but with her dysfunctional family and life's many setbacks, it's always an uphill battle.",Mom,tvshow
685682fc8482e0a7a0072647,tvmaze_131,"Drama, Comedy, Romance",6.5,2014-02-22,30,tvmaze,"Will Freeman lives a charmed existence as the ultimate man-child. After writing a hit song, he was granted a life of free time, free love and freedom from financial woes. He's single, unemployed and loving it. So imagine his surprise when Fiona, a needy, single mom and her oddly charming 11-year-old son Marcus move in next door and disrupt his perfect world.",About a Boy,tvshow
685682fc8482e0a7a0072648,tvmaze_132,Comedy,6.2,2013-10-03,30,tvmaze,"The Millers follows Nathan Miller, a recently divorced local roving news reporter looking forward to living the singles life until his parents' marital problems unexpectedly derail his plans. After Nathan finally breaks the news of his divorce to his parents Carol and Tom, his father is inspired to follow suit and stuns the family when he leaves his wife of 43 years. Already in shock, Nathan is even more aghast when his meddlesome mom decides to move in with him. Meanwhile, his absent-minded dad imposes upon Nathan's sister Debbie, her husband Adam and their daughter. Nathan's best friend and news cameraman Ray was excited to be Nathan's wingman in the dating scene, but Carol manages to even cramp his style. Now, as Nathan and his sister settle in with their truly impossible parents, they both wonder just how long the aggravating adjustment period is going to last.",The Millers,tvshow
685682fc8482e0a7a0072649,tvmaze_137,"Comedy, Legal",7.0,2014-10-10,30,tvmaze,Cristela's dream of becoming a lawyer is something her traditional Mexican-American family doesn't quite understand. She's entering her sixth year of law school after juggling home obligations and working multiple jobs to pay her way.,Cristela,tvshow
